{
  "schema": "tno.post_phase6.readiness.non_interaction.v1",
  "checkpoint": "R3",
  "source_baseline": "d212695c006f503f1b175e4b9a7a57e2f0ebf5ac",
  "conclusion": "NO_KNOWN_VIOLATION_IN_ACCEPTED_SCOPE",
  "classification_rule": "RUNTIME_PROVEN always applies only to the stated accepted captures, never all bosses or combinations. SOURCE_PROVEN describes the reviewed installed/production boundaries with runtime subsets noted separately. Historical document-only runtime summaries are INDIRECTLY_SUPPORTED. No experiment is run for this consolidation.",
  "invariants": [
    {
      "id": "G01", "rule": "No global external-weapon buff", "classification": "SOURCE_PROVEN",
      "scope": "Current production classification and eligible native family wrappers.",
      "evidence": "GearStageClasses explicitly classifies Royal Bow; unclassified gear resolves no Stage. NativeScalableDamage selects exact native family holders, and wrappers modify only their existing eligible operation. No global attack attribute multiplier.",
      "evidence_sources": ["src/main/java/com/tno/tensuracompat/core/stage/GearStageClasses.java", "src/main/java/com/tno/tensuracompat/core/stage/ProductionStageScaling.java", "src/main/java/com/tno/tensuracompat/core/stage/NativeScalableDamage.java", "docs/phase-6-production-implementation.md"],
      "runtime_limit": "Accepted native/plain controls support isolation, but there is no exhaustive runtime matrix of every external weapon."
    },
    {
      "id": "G02", "rule": "No duplicated DamageSource delivery", "classification": "RUNTIME_PROVEN",
      "scope": "Accepted P5, Elemental E2, Soul S3/S3F, Energy ES3 and Severance sustained captures.",
      "evidence": "P5 has 860 physical and 860 legitimate family events, not duplicate physical damage. Soul/Elemental/Energy strict captures reject duplicate identities/calls. Native Severance ceiling enforcement may emit a separate entity-less tensura:severance source; V4 records 1238 attempts/360 applications separately from 1664 physical events. No second physical hit is invented.",
      "evidence_sources": ["docs/benchmarks/phase6-endgame-magic-holy-production/README.md", "docs/benchmarks/phase6-elemental-native-event-path/e2-validation.json", "docs/benchmarks/phase6-soul-native-event-path/s4-decision.json", "docs/benchmarks/phase6-energy-steal-physical-prerequisite/es4-final-decision.json", "docs/benchmarks/phase6-candidate-c-sustained-viability/v4-decision.json"],
      "runtime_limit": "No exhaustive simultaneous family/equipment/multiplayer matrix. Candidate-C metrics validate that development capture only; they do not approve the architecture."
    },
    {
      "id": "G03", "rule": "No phantom native event", "classification": "RUNTIME_PROVEN",
      "scope": "Accepted positive, plain, legacy-empty and native-defense controls in the causal family studies.",
      "evidence": "Elemental's 15 empty-dispatch controls create no native source; natural ticking restores legitimate delivery. Plain Soul controls create none; native gates explain source/event differences. Energy absent callbacks create no drain or phantom cooldown. Incoming/source/accepted-event counts are separately recorded.",
      "evidence_sources": ["docs/benchmarks/phase6-elemental-native-event-path/e3-decision.json", "docs/benchmarks/phase6-soul-native-event-path/s3-comparison.json", "docs/benchmarks/phase6-energy-steal-physical-prerequisite/es4-final-decision.json"],
      "runtime_limit": "Only the accepted controls are directly proven; no claim that all possible native vetoes were exercised."
    },
    {
      "id": "G04", "rule": "No direct fabricated HP/SHP/resource subtraction", "classification": "SOURCE_PROVEN",
      "scope": "Approved production wrappers, distinct from documented development fixture setup and native storage writers.",
      "evidence": "AdditionalDamage, Soul and Energy wrappers call the original native operation once with a scoped argument; Slotting changes the native projectile coefficient. Native wound owns its storage/heal ceiling. Soul/Energy runtime setter reconciliation finds no unexplained changes. Diagnostic HP placement in P2 is setup for A/B/C states, not production subtraction.",
      "evidence_sources": ["src/main/java/com/tno/tensuracompat/mixin/AdditionalDamageEntityMixin.java", "src/main/java/com/tno/tensuracompat/mixin/SpiritualDamageEntityMixin.java", "src/main/java/com/tno/tensuracompat/mixin/EnergyStealEntityMixin.java", "src/main/java/com/tno/tensuracompat/mixin/SlottingHelperMixin.java", "docs/benchmarks/phase6-soul-native-event-path/s4-decision.json", "docs/benchmarks/phase6-energy-steal-physical-prerequisite/es4-final-decision.json", "docs/phase-6-regenerate-severance-counter-protocol-research.md"],
      "runtime_limit": "Runtime accounting is scoped to recorded actors/cases; no general assertion about every third-party resource writer."
    },
    {
      "id": "G05", "rule": "Stage creates no effect when the native mechanic is absent", "classification": "RUNTIME_PROVEN",
      "scope": "Soul/Energy plain controls, Elemental legacy dispatch and native-denial controls; production source guard also reviewed.",
      "evidence": "Stage scales only an already reached native family boundary. Plain S0/S7 Soul remains absent; plain native Energy has no drain. Elemental absent dispatch is not repaired by Stage. Source classification leaves unrecognized holders unchanged; native Severance level<=0 gives no adjustment.",
      "evidence_sources": ["docs/benchmarks/phase6-soul-native-event-path/s3-comparison.json", "docs/benchmarks/phase6-energy-steal-physical-prerequisite/es2-validation.json", "docs/benchmarks/phase6-elemental-native-event-path/e2-validation.json", "src/main/java/com/tno/tensuracompat/core/stage/NativeScalableDamage.java", "src/main/java/com/tno/tensuracompat/core/stage/SeveranceStageScaling.java"],
      "runtime_limit": "Not a runtime test of every absent enchantment/family/Stage combination."
    },
    {
      "id": "G06", "rule": "No duplicate drain", "classification": "RUNTIME_PROVEN",
      "scope": "77 decisive Energy rows, including native controls and both physical-prerequisite comparisons.",
      "evidence": "Each eligible native callback has one apply/drain operation with reconciled MP/AP/cooldown writes. ES3a has 22 drains; the historical differential 35. Rejections have none. Strict negative suites reject duplicate/forged operations.",
      "evidence_sources": ["docs/benchmarks/phase6-energy-steal-physical-prerequisite/es4-final-decision.json", "docs/benchmarks/phase6-energy-steal-physical-prerequisite/es4-evidence-validation.json"],
      "runtime_limit": "The preserved initial double-release research diagnostic is invalid acceptance evidence and excluded; corrected production-native capture has no duplicate."
    },
    {
      "id": "G07", "rule": "No duplicate Soul effect", "classification": "RUNTIME_PROVEN",
      "scope": "Accepted S2 native controls plus S3/S3F Royal comparison.",
      "evidence": "20 Royal callbacks produce 16 native sources and 12 accepted spiritual continuations; each accepted continuation has one native SHP subtraction. Recoveries are separately recorded native operations, not extra Soul hits.",
      "evidence_sources": ["docs/benchmarks/phase6-soul-native-event-path/s3-comparison.json", "docs/benchmarks/phase6-soul-native-event-path/s4-decision.json", "docs/benchmarks/phase6-soul-native-event-path/s2-validation.json"],
      "runtime_limit": "Single-shot selected profiles only; all multiplayer/combination interactions remain untested."
    },
    {
      "id": "G08", "rule": "No duplicate Elemental delivery", "classification": "RUNTIME_PROVEN",
      "scope": "90 accepted single-core cases, five elements, including same-UUID rescue.",
      "evidence": "90 distinct projectiles, zero duplicate family events. 75 sources, 71 incoming, 46 applied reflect actual native dispatch and defenses. Intercepted one-core release makes no Royal Arrow. Later on_fire and native utility are kept separate.",
      "evidence_sources": ["docs/benchmarks/phase6-elemental-native-event-path/e2-validation.json", "docs/benchmarks/phase6-elemental-native-event-path/e3-decision.json"],
      "runtime_limit": "Not multi-core, area-overlap, all-target or multiplayer acceptance."
    },
    {
      "id": "G09", "rule": "No persistent TNO Gear EP progression", "classification": "SOURCE_PROVEN",
      "scope": "NativeGearEpSource/StageResolver and existing projectile/first-engraving metadata.",
      "evidence": "Stage reads Tensura EP from the gear component; no separate TNO XP/EP accumulation or arrow progression. Elemental persistent projectile data holds only an attack-time Stage snapshot for delayed collision, not independent progression. The first-engraving item marker is one-time conversion metadata, not XP.",
      "evidence_sources": ["src/main/java/com/tno/tensuracompat/core/stage/NativeGearEpSource.java", "src/main/java/com/tno/tensuracompat/core/stage/StageResolver.java", "src/main/java/com/tno/tensuracompat/core/stage/ElementalStageProjectileContext.java", "src/main/java/com/tno/tensuracompat/compat/royalvariations/RoyalBowFirstEngraving.java", "docs/phase-6-production-implementation.md"],
      "runtime_limit": "No new save/reload or human-client progression test was performed for this review."
    },
    {
      "id": "G10", "rule": "No unexpected L2 bypass", "classification": "SOURCE_PROVEN",
      "scope": "Production native source wrappers and approved exact Magic/Holy L2 negotiation, supported by accepted full-stack captures.",